{
  "$schema": "https://esm.sh/gh/uniswap/token-lists/src/tokenlist.schema.json",
  "name": "Your Chain",
  "logoURI": "https://esm.sh/gh/tempoxyz/tempo-apps/apps/tokenlist/data/7447/icon.svg",
  "timestamp": "2026-04-10T00:00:00Z",
  "version": {
    "major": 1,
    "minor": 0,
    "patch": 0
  },
  "tokens": [
    {
      "name": "pathFEE",
      "symbol": "FEE",
      "decimals": 18,
      "chainId": 7447,
      "address": "0x20c0000000000000000000000000000000000000",
      "logoURI": "https://esm.sh/gh/tempoxyz/tempo-apps/apps/tokenlist/data/7447/icons/0x20c0000000000000000000000000000000000000.svg"
    }
  ]
}
