{
	"$schema": "https://esm.sh/gh/uniswap/token-lists/src/tokenlist.schema.json",
	"name": "Tempo Testnet (Andantino - Deprecated)",
	"logoURI": "https://esm.sh/gh/tempoxyz/tokenlist/data/42429/icon.svg",
	"timestamp": "2026-03-09T00:00:00Z",
	"version": {
		"major": 1,
		"minor": 1,
		"patch": 0
	},
	"tokens": [
		{
			"name": "pathUSD",
			"symbol": "pathUSD",
			"decimals": 6,
			"chainId": 42429,
			"address": "0x20c0000000000000000000000000000000000000",
			"logoURI": "https://esm.sh/gh/tempoxyz/tempo-apps/apps/tokenlist/data/42429/icons/0x20c0000000000000000000000000000000000000.svg",
			"extensions": {
				"chain": "tempo",
				"label": "pathUSD"
			}
		},
		{
			"name": "AlphaUSD",
			"symbol": "alphaUSD",
			"decimals": 6,
			"chainId": 42429,
			"address": "0x20c0000000000000000000000000000000000001",
			"logoURI": "https://esm.sh/gh/tempoxyz/tempo-apps/apps/tokenlist/data/42429/icons/0x20c0000000000000000000000000000000000001.svg",
			"extensions": {
				"chain": "tempo",
				"label": "AlphaUSD"
			}
		},
		{
			"name": "BetaUSD",
			"symbol": "betaUSD",
			"decimals": 6,
			"chainId": 42429,
			"address": "0x20c0000000000000000000000000000000000002",
			"logoURI": "https://esm.sh/gh/tempoxyz/tempo-apps/apps/tokenlist/data/42429/icons/0x20c0000000000000000000000000000000000002.svg",
			"extensions": {
				"chain": "tempo",
				"label": "BetaUSD"
			}
		},
		{
			"name": "ThetaUSD",
			"symbol": "thetaUSD",
			"decimals": 6,
			"chainId": 42429,
			"address": "0x20c0000000000000000000000000000000000003",
			"logoURI": "https://esm.sh/gh/tempoxyz/tempo-apps/apps/tokenlist/data/42429/icons/0x20c0000000000000000000000000000000000003.svg",
			"extensions": {
				"chain": "tempo",
				"label": "ThetaUSD"
			}
		}
	]
}
