{
  "$schema": "https://esm.sh/gh/uniswap/token-lists/src/tokenlist.schema.json",
  "name": "PaysoNow Mainnet",
  "logoURI": "https://esm.sh/gh/tempoxyz/tempo-apps/apps/tokenlist/data/3773/icons/paysonow.svg",
  "timestamp": "2026-04-21T00:00:00Z",
  "version": {
    "major": 1,
    "minor": 0,
    "patch": 0
  },
  "tokens": [
    {
      "name": "PUSD",
      "symbol": "PUSD",
      "decimals": 6,
      "chainId": 3773,
      "address": "0x20c0000000000000000000000000000000000000",
      "logoURI": "https://esm.sh/gh/tempoxyz/tempo-apps/apps/tokenlist/data/3773/icons/0x20c0000000000000000000000000000000000000.svg",
      "extensions": {
        "chain": "paysonow",
        "label": "PUSD"
      }
    },
    {
      "name": "Sao Mai Solar 2024",
      "symbol": "SAOMSO124",
      "decimals": 18,
      "chainId": 3773,
      "address": "0x3224304c75c5118af069ba7ce0b290acd067e46e",
      "logoURI": "https://esm.sh/gh/tempoxyz/tempo-apps/apps/tokenlist/data/3773/icons/0x3224304c75c5118af069ba7ce0b290acd067e46e.svg",
      "extensions": {
        "chain": "paysonow",
        "label": "SAOMSO124"
      }
    }
  ]
}
