{
	"$schema": "https://esm.sh/gh/uniswap/token-lists/src/tokenlist.schema.json",
	"name": "Tempo Testnet (Moderato)",
	"logoURI": "https://esm.sh/gh/tempoxyz/tokenlist/data/42431/icon.svg",
	"timestamp": "2026-03-30T16:28:11Z",
	"version": {
		"major": 1,
		"minor": 1,
		"patch": 2
	},
	"tokens": [
		{
			"name": "PathUSD",
			"symbol": "pathUSD",
			"decimals": 6,
			"chainId": 42431,
			"address": "0x20c0000000000000000000000000000000000000",
			"logoURI": "https://esm.sh/gh/tempoxyz/tempo-apps/apps/tokenlist/data/42431/icons/0x20c0000000000000000000000000000000000000.svg",
			"extensions": {
				"chain": "tempo",
				"label": "PathUSD"
			}
		},
		{
			"name": "AlphaUSD",
			"symbol": "alphaUSD",
			"decimals": 6,
			"chainId": 42431,
			"address": "0x20c0000000000000000000000000000000000001",
			"logoURI": "https://esm.sh/gh/tempoxyz/tempo-apps/apps/tokenlist/data/42431/icons/0x20c0000000000000000000000000000000000001.svg",
			"extensions": {
				"chain": "tempo",
				"label": "AlphaUSD"
			}
		},
		{
			"name": "BetaUSD",
			"symbol": "betaUSD",
			"decimals": 6,
			"chainId": 42431,
			"address": "0x20c0000000000000000000000000000000000002",
			"logoURI": "https://esm.sh/gh/tempoxyz/tempo-apps/apps/tokenlist/data/42431/icons/0x20c0000000000000000000000000000000000002.svg",
			"extensions": {
				"chain": "tempo",
				"label": "BetaUSD"
			}
		},
		{
			"name": "ThetaUSD",
			"symbol": "thetaUSD",
			"decimals": 6,
			"chainId": 42431,
			"address": "0x20c0000000000000000000000000000000000003",
			"logoURI": "https://esm.sh/gh/tempoxyz/tempo-apps/apps/tokenlist/data/42431/icons/0x20c0000000000000000000000000000000000003.svg",
			"extensions": {
				"chain": "tempo",
				"label": "ThetaUSD"
			}
		},
		{
			"name": "Bridged USDC (Stargate)",
			"symbol": "USDC.e",
			"decimals": 6,
			"chainId": 42431,
			"address": "0x20c0000000000000000000009e8d7eb59b783726",
			"logoURI": "https://esm.sh/gh/tempoxyz/tempo-apps/apps/tokenlist/data/42431/icons/0x20c0000000000000000000009e8d7eb59b783726.svg",
			"extensions": {
				"chain": "tempo",
				"label": "USDC.e"
			}
		},
		{
			"name": "Bridged EURC (Stargate)",
			"symbol": "EURC.e",
			"decimals": 6,
			"chainId": 42431,
			"address": "0x20c000000000000000000000d72572838bbee59c",
			"logoURI": "https://esm.sh/gh/tempoxyz/tempo-apps/apps/tokenlist/data/42431/icons/0x20c000000000000000000000d72572838bbee59c.svg",
			"extensions": {
				"chain": "tempo",
				"label": "EURC"
			}
		}
	]
}
